{
  "$schema": "https://json-schema.org/draft/2020-12/schema",
  "$id": "https://nhm.local/contracts/model_v2_run_manifest_v1.schema.json",
  "title": "NHM MODEL_V2 Run Manifest v1",
  "description": "Additive schema for the separate MODEL_V2 research lineage (V2-xxx task/phase IDs). Never used to validate, and never a substitute for, the canonical contracts/run_manifest_v1.schema.json (^T[0-9]{3}$ only), which this schema leaves byte-unchanged.",
  "type": "object",
  "additionalProperties": false,
  "required": [
    "schema_id",
    "manifest_version",
    "run_id",
    "created_at_utc",
    "phase_id",
    "task_id",
    "spec_version",
    "git_commit",
    "git_dirty",
    "python_version",
    "platform",
    "config_path",
    "config_sha256",
    "dependency_snapshot_path",
    "dependency_snapshot_sha256",
    "input_artifacts",
    "output_artifacts",
    "seed",
    "notes"
  ],
  "properties": {
    "schema_id": { "const": "MODEL_V2_RUN_MANIFEST_V1" },
    "manifest_version": { "const": "1.0" },
    "run_id": { "type": "string", "minLength": 1 },
    "created_at_utc": { "type": "string", "format": "date-time" },
    "phase_id": { "type": "string", "pattern": "^V2-[0-9]{3}$" },
    "task_id": { "type": "string", "pattern": "^V2-[0-9]{3}$" },
    "spec_version": { "const": "2.2" },
    "git_commit": { "type": ["string", "null"], "pattern": "^[0-9a-f]{40,64}$" },
    "git_dirty": { "type": ["boolean", "null"] },
    "python_version": { "type": "string", "minLength": 1 },
    "platform": { "type": "string", "minLength": 1 },
    "config_path": { "type": ["string", "null"] },
    "config_sha256": { "type": ["string", "null"], "pattern": "^[0-9a-f]{64}$" },
    "dependency_snapshot_path": { "type": ["string", "null"] },
    "dependency_snapshot_sha256": {
      "type": ["string", "null"],
      "pattern": "^[0-9a-f]{64}$"
    },
    "input_artifacts": { "$ref": "#/$defs/artifacts" },
    "output_artifacts": { "$ref": "#/$defs/artifacts" },
    "seed": { "type": ["integer", "null"] },
    "notes": { "type": ["string", "null"] },
    "corrective_checkpoint": { "type": ["string", "null"] }
  },
  "$defs": {
    "artifact": {
      "type": "object",
      "additionalProperties": false,
      "required": ["path", "sha256"],
      "properties": {
        "path": { "type": "string", "minLength": 1 },
        "sha256": { "type": "string", "pattern": "^[0-9a-f]{64}$" }
      }
    },
    "artifacts": {
      "type": "array",
      "items": { "$ref": "#/$defs/artifact" }
    }
  }
}
