{
  "config_path": "configs/model_v2/architecture_causality_v1.yaml",
  "config_sha256": "f33f369a22bd907691e6d1f9730ccdfb413b5fb2bfcdc467f0fb5a095bb02f7e",
  "corrective_checkpoint": null,
  "created_at_utc": "2026-10-03T00:26:22.006205Z",
  "dependency_snapshot_path": null,
  "dependency_snapshot_sha256": null,
  "git_commit": "31a82649079e495e0c1d9eee100bc29620d91301",
  "git_dirty": true,
  "input_artifacts": [
    {
      "path": "manifests/model_v2/cv/MITDB_TRAIN_CV_V2_V1.csv",
      "sha256": "cc5258191759d5ba102cac7d40497c6bccf85055201c016fc4132d69a2fb76c6"
    },
    {
      "path": "manifests/model_v2/cv/MITDB_TRAIN_INNER_V2_V1.csv",
      "sha256": "24f7ddc8b6268427a365505785d0cc60d489a2bd2e8e69665ff4c9b49e093224"
    },
    {
      "path": "configs/model_v1.yaml",
      "sha256": "f46810593edbc3d74e00d1ad992fe2af5b02a0b9474118374a90f0bd1fd338dc"
    }
  ],
  "manifest_version": "1.0",
  "notes": "V2-004 D2 fit V2-004-D2-TCNMEAN-F02-S20260928: architecture=MODEL_V2_TCN_MEAN outer_fold=2 seed=20260928",
  "output_artifacts": [
    {
      "path": "reports/model_v2/v2_004/runs/V2-004-D2-TCNMEAN-F02-S20260928/outer_predictions.csv",
      "sha256": "73a0a7f16d11027977228c1f025cb481dff84b0b127e5220754dfbdd8377b6e6"
    },
    {
      "path": "reports/model_v2/v2_004/runs/V2-004-D2-TCNMEAN-F02-S20260928/training_curve.csv",
      "sha256": "5bdd24212efe7437fccc745a99a6a67ed7bd54d57c61013c6c9f736b06b013af"
    },
    {
      "path": "checkpoints/model_v2/v2_004_arch_causality/V2-004-D2-TCNMEAN-F02-S20260928_best.pt",
      "sha256": "ed99953aa62dd437e82a7d542e671bb254ca3cc2474518e6fa696d42f7ea3914"
    }
  ],
  "phase_id": "V2-004",
  "platform": "macOS-27.0.1-arm64-arm-64bit",
  "python_version": "3.11.16",
  "run_id": "V2-004-D2-TCNMEAN-F02-S20260928",
  "schema_id": "MODEL_V2_RUN_MANIFEST_V1",
  "seed": 20260928,
  "spec_version": "2.2",
  "task_id": "V2-004"
}
