{
  "config_path": "configs/model_v2/architecture_causality_v1.yaml",
  "config_sha256": "f33f369a22bd907691e6d1f9730ccdfb413b5fb2bfcdc467f0fb5a095bb02f7e",
  "corrective_checkpoint": null,
  "created_at_utc": "2026-10-02T23:28:50.240430Z",
  "dependency_snapshot_path": null,
  "dependency_snapshot_sha256": null,
  "git_commit": "b1d11a97b3059a8f2f7e62243e2b3cd8059bc696",
  "git_dirty": true,
  "input_artifacts": [
    {
      "path": "manifests/model_v2/cv/MITDB_TRAIN_CV_V2_V1.csv",
      "sha256": "cc5258191759d5ba102cac7d40497c6bccf85055201c016fc4132d69a2fb76c6"
    },
    {
      "path": "manifests/model_v2/cv/MITDB_TRAIN_INNER_V2_V1.csv",
      "sha256": "24f7ddc8b6268427a365505785d0cc60d489a2bd2e8e69665ff4c9b49e093224"
    },
    {
      "path": "configs/model_v1.yaml",
      "sha256": "f46810593edbc3d74e00d1ad992fe2af5b02a0b9474118374a90f0bd1fd338dc"
    }
  ],
  "manifest_version": "1.0",
  "notes": "V2-004 D1 fit V2-004-D1-MEANMAX-F03-S20260927: architecture=MODEL_V2_TCN_MEANMAX outer_fold=3 seed=20260927",
  "output_artifacts": [
    {
      "path": "reports/model_v2/v2_004/runs/V2-004-D1-MEANMAX-F03-S20260927/outer_predictions.csv",
      "sha256": "a9689e941382584285917e7f35efdbc98ef01d0f2287ab1687e57f3bfe3f096e"
    },
    {
      "path": "reports/model_v2/v2_004/runs/V2-004-D1-MEANMAX-F03-S20260927/training_curve.csv",
      "sha256": "5b644e919341d04ddfb5a1e8238d7d11c38bf97034640cb5e193aab61d7d54fe"
    },
    {
      "path": "checkpoints/model_v2/v2_004_arch_causality/V2-004-D1-MEANMAX-F03-S20260927_best.pt",
      "sha256": "76947642a1631758cf671e623381b393194464a4e3b90089d7c46dfcd0695535"
    }
  ],
  "phase_id": "V2-004",
  "platform": "macOS-27.0.1-arm64-arm-64bit",
  "python_version": "3.11.16",
  "run_id": "V2-004-D1-MEANMAX-F03-S20260927",
  "schema_id": "MODEL_V2_RUN_MANIFEST_V1",
  "seed": 20260927,
  "spec_version": "2.2",
  "task_id": "V2-004"
}
