{
  "config_path": "configs/model_v2/optimizer_correction_v1.yaml",
  "config_sha256": "288a1185d5ba74d5f3bfb5729fc73197f1181ceae01c99db4580f86bc5f6dafc",
  "corrective_checkpoint": null,
  "created_at_utc": "2026-10-03T09:55:27.131037Z",
  "dependency_snapshot_path": null,
  "dependency_snapshot_sha256": null,
  "git_commit": "75108fbe983d964e2d396243a87dfca9f235f410",
  "git_dirty": true,
  "input_artifacts": [
    {
      "path": "manifests/model_v2/cv/MITDB_TRAIN_CV_V2_V1.csv",
      "sha256": "cc5258191759d5ba102cac7d40497c6bccf85055201c016fc4132d69a2fb76c6"
    },
    {
      "path": "manifests/model_v2/cv/MITDB_TRAIN_INNER_V2_V1.csv",
      "sha256": "24f7ddc8b6268427a365505785d0cc60d489a2bd2e8e69665ff4c9b49e093224"
    },
    {
      "path": "configs/model_v1.yaml",
      "sha256": "f46810593edbc3d74e00d1ad992fe2af5b02a0b9474118374a90f0bd1fd338dc"
    },
    {
      "path": "configs/model_v2/optimizer_correction_v1.yaml",
      "sha256": "288a1185d5ba74d5f3bfb5729fc73197f1181ceae01c99db4580f86bc5f6dafc"
    }
  ],
  "manifest_version": "1.0",
  "notes": "V2-006 challenger fit V2-006-OPT-CORR-F02-S20260927: architecture=MODEL_V2_TCN_MEANMAX schedule=MODEL_V2_OPTIMIZER_CORRECTED_V1 outer_fold=2 seed=20260927",
  "output_artifacts": [
    {
      "path": "reports/model_v2/v2_006/runs/V2-006-OPT-CORR-F02-S20260927/outer_predictions.csv",
      "sha256": "7ba5a0047fd78f700053b6d62e59edcd4e65e9bfca75d832f0c793a21ebf08b0"
    },
    {
      "path": "reports/model_v2/v2_006/runs/V2-006-OPT-CORR-F02-S20260927/training_curve.csv",
      "sha256": "2a25c4c0286887716e4be5d2bb03ac48599ff2a0bf6dfc213c1900242779d6bd"
    },
    {
      "path": "checkpoints/model_v2/v2_006_optimizer_correction/V2-006-OPT-CORR-F02-S20260927_best.pt",
      "sha256": "2029f4fe065d1d411b5725a7ad67cb5ccbee5e6a29175f6fb5f79b514956dfdf"
    }
  ],
  "phase_id": "V2-006",
  "platform": "macOS-27.0.1-arm64-arm-64bit",
  "python_version": "3.11.16",
  "run_id": "V2-006-OPT-CORR-F02-S20260927",
  "schema_id": "MODEL_V2_RUN_MANIFEST_V1",
  "seed": 20260927,
  "spec_version": "2.2",
  "task_id": "V2-006"
}
